{
  "v": "1", "agent_id": "agent-backend-1", "role_id": "ENG.backend",
  "profile_ref": "agency://backend-architect@pinned", "skill_refs": ["matt://tdd@pinned", "ponytail://core@pinned"],
  "session_id": "S-1", "job_id": "J-API", "attempt_id": "A-0001",
  "fence_generation": 1, "state": "CLOSED", "checkpoint_ref": "artifact://checkpoint-patch-1",
  "policy_ref": "policy://engineering-v1"
}
